Id,Id2,Geography,Estimate; HOUSING OCCUPANCY - Total housing units,Percent; HOUSING OCCUPANCY - Total housing units,Estimate; HOUSING OCCUPANCY - Total housing units - Occupied housing units,Percent; HOUSING OCCUPANCY - Total housing units - Occupied housing units,Estimate; HOUSING OCCUPANCY - Total housing units - Vacant housing units,Percent; HOUSING OCCUPANCY - Total housing units - Vacant housing units,Estimate; HOUSING OCCUPANCY - Homeowner vacancy rate,Percent; HOUSING OCCUPANCY - Homeowner vacancy rate,Estimate; HOUSING OCCUPANCY - Rental vacancy rate,Percent; HOUSING OCCUPANCY - Rental vacancy rate,Estimate; HOUSING TENURE - Occupied housing units,Percent; HOUSING TENURE - Occupied housing units,Estimate; HOUSING TENURE - Occupied housing units - Owner-occupied,Percent; HOUSING TENURE - Occupied housing units - Owner-occupied,Estimate; HOUSING TENURE - Occupied housing units - Renter-occupied,Percent; HOUSING TENURE - Occupied housing units - Renter-occupied
310M300US47220,47220,"Vineland-Bridgeton, NJ Metro Area",56299,56299,50718,90.1,5581,9.9,1.5,(X),5.5,(X),50718,50718,32632,64.3,18086,35.7
310M300US47260,47260,"Virginia Beach-Norfolk-Newport News, VA-NC Metro Area",706394,706394,636750,90.1,69644,9.9,2,(X),6.9,(X),636750,636750,388609,61,248141,39
310M300US47300,47300,"Visalia-Porterville, CA Metro Area",145661,145661,134153,92.1,11508,7.9,1.7,(X),3.2,(X),134153,134153,75761,56.5,58392,43.5
310M300US47380,47380,"Waco, TX Metro Area",105463,105463,92632,87.8,12831,12.2,1.6,(X),5.4,(X),92632,92632,54643,59,37989,41
310M300US47460,47460,"Walla Walla, WA Metro Area",25996,25996,23540,90.6,2456,9.4,1.6,(X),5.3,(X),23540,23540,15374,65.3,8166,34.7
310M300US47580,47580,"Warner Robins, GA Metro Area",76531,76531,67983,88.8,8548,11.2,1.2,(X),7.9,(X),67983,67983,44115,64.9,23868,35.1
310M300US47900,47900,"Washington-Arlington-Alexandria, DC-VA-MD-WV Metro Area",2303093,2303093,2155967,93.6,147126,6.4,1.2,(X),4.9,(X),2155967,2155967,1357660,63,798307,37
310M300US47940,47940,"Waterloo-Cedar Falls, IA Metro Area",72485,72485,67011,92.4,5474,7.6,1.7,(X),7.2,(X),67011,67011,46671,69.6,20340,30.4
310M300US48060,48060,"Watertown-Fort Drum, NY Metro Area",58728,58728,43428,73.9,15300,26.1,2.8,(X),7.1,(X),43428,43428,24333,56,19095,44
310M300US48140,48140,"Wausau, WI Metro Area",58358,58358,54003,92.5,4355,7.5,1.6,(X),3.7,(X),54003,54003,39239,72.7,14764,27.3
310M300US48260,48260,"Weirton-Steubenville, WV-OH Metro Area",57805,57805,50554,87.5,7251,12.5,1.6,(X),7.7,(X),50554,50554,35809,70.8,14745,29.2
310M300US48300,48300,"Wenatchee, WA Metro Area",52465,52465,41548,79.2,10917,20.8,1.2,(X),7,(X),41548,41548,28075,67.6,13473,32.4
310M300US48540,48540,"Wheeling, WV-OH Metro Area",69048,69048,59557,86.3,9491,13.7,0.8,(X),7.3,(X),59557,59557,43140,72.4,16417,27.6
310M300US48620,48620,"Wichita, KS Metro Area",270248,270248,243758,90.2,26490,9.8,1.9,(X),7.8,(X),243758,243758,159771,65.5,83987,34.5
310M300US48660,48660,"Wichita Falls, TX Metro Area",65273,65273,56052,85.9,9221,14.1,2.5,(X),10.7,(X),56052,56052,35517,63.4,20535,36.6
310M300US48700,48700,"Williamsport, PA Metro Area",52644,52644,45587,86.6,7057,13.4,1.1,(X),7.1,(X),45587,45587,31989,70.2,13598,29.8
310M300US48900,48900,"Wilmington, NC Metro Area",132942,132942,110133,82.8,22809,17.2,2.1,(X),7.7,(X),110133,110133,67532,61.3,42601,38.7
310M300US49020,49020,"Winchester, VA-WV Metro Area",58195,58195,50487,86.8,7708,13.2,2.3,(X),5.2,(X),50487,50487,34126,67.6,16361,32.4
310M300US49180,49180,"Winston-Salem, NC Metro Area",291225,291225,259085,89,32140,11,2.3,(X),8.5,(X),259085,259085,173708,67,85377,33
310M300US49340,49340,"Worcester, MA-CT Metro Area",378450,378450,347055,91.7,31395,8.3,1.5,(X),5.5,(X),347055,347055,226817,65.4,120238,34.6
310M300US49420,49420,"Yakima, WA Metro Area",86393,86393,80196,92.8,6197,7.2,1.7,(X),4.1,(X),80196,80196,50246,62.7,29950,37.3
310M300US49620,49620,"York-Hanover, PA Metro Area",180618,180618,168008,93,12610,7,1.6,(X),4.9,(X),168008,168008,125132,74.5,42876,25.5
310M300US49660,49660,"Youngstown-Warren-Boardman, OH-PA Metro Area",258345,258345,229342,88.8,29003,11.2,2.9,(X),6.5,(X),229342,229342,160647,70,68695,30
310M300US49700,49700,"Yuba City, CA Metro Area",62141,62141,57683,92.8,4458,7.2,1.5,(X),4.8,(X),57683,57683,33254,57.6,24429,42.4
310M300US49740,49740,"Yuma, AZ Metro Area",90071,90071,70924,78.7,19147,21.3,2.3,(X),8.5,(X),70924,70924,47826,67.4,23098,32.6
